{
  "schemaVersion": "1.0",
  "key": "ca_dmv_reg195",
  "version": "0.1.0",
  "name": "Application for Disabled Person Placard or Plates",
  "shortName": "California DMV disabled parking placard or plates",
  "issuer": "California Department of Motor Vehicles",
  "jurisdiction": "California, United States",
  "status": "draft",
  "source": {
    "officialUrl": "https://www.dmv.ca.gov/portal/uploads/2024/07/REG-195-R11-2023-AS-WWW-002.pdf",
    "revisionLabel": "REG 195, revision 11/2023",
    "blankAssetPath": "assets/forms/ca_dmv_reg195/2023-11/blank.pdf",
    "reviewedAt": "2026-07-18"
  },
  "legalNotes": [
    "The exact DMV form was not confirmed in the product discussion. REG 195 is a demo assumption.",
    "The currently published instructions state that original signatures are required. Do not assume an app signature is accepted.",
    "A clinician must verify and sign all provider certification content.",
    "This starter template requires clinical, legal, and coordinate review before production."
  ],
  "formSelection": {
    "aliases": [
      "REG 195",
      "DMV disabled placard form",
      "disabled parking placard form",
      "handicap placard form",
      "disabled person plates form"
    ],
    "purposeExamples": [
      "I need a parking placard because I cannot walk far.",
      "My doctor needs to sign DMV paperwork for disabled parking.",
      "I need disabled person plates or a placard."
    ],
    "patientDescription": "Use this form to apply for a California disabled person parking placard or disabled person license plates. A medical provider completes and signs the certification section.",
    "positiveClues": [
      "REG 195",
      "disabled person placard",
      "disabled parking placard",
      "DMV",
      "medical provider certification"
    ],
    "exclusionClues": [
      "driver medical evaluation",
      "reexamination",
      "commercial driver",
      "EDD disability",
      "FMLA"
    ]
  },
  "sections": [
    {
      "id": "applicant_information",
      "title": "Applicant Information",
      "patientTitle": "About you",
      "order": 10,
      "owner": "patient",
      "renderOnOfficialForm": true
    },
    {
      "id": "request_information",
      "title": "Placard or Plate Request",
      "patientTitle": "What you are requesting",
      "order": 20,
      "owner": "patient",
      "renderOnOfficialForm": true
    },
    {
      "id": "prior_placard",
      "title": "Prior Placard Information",
      "patientTitle": "Previous placard",
      "order": 30,
      "owner": "patient",
      "renderOnOfficialForm": true
    },
    {
      "id": "vehicle_information",
      "title": "Vehicle Information",
      "patientTitle": "Vehicle information",
      "order": 40,
      "owner": "patient",
      "renderOnOfficialForm": true
    },
    {
      "id": "patient_facts",
      "title": "Patient-Reported Functional Information",
      "patientTitle": "What you told us about walking and mobility",
      "description": "Evidence collected for clinician review. These fields do not directly certify eligibility.",
      "order": 50,
      "owner": "patient",
      "renderOnOfficialForm": false
    },
    {
      "id": "patient_attestation",
      "title": "Applicant Attestation",
      "patientTitle": "Review and sign",
      "order": 60,
      "owner": "patient",
      "renderOnOfficialForm": true
    },
    {
      "id": "provider_information",
      "title": "Medical Provider Information",
      "patientTitle": "Clinic information",
      "order": 70,
      "owner": "clinician",
      "renderOnOfficialForm": true
    },
    {
      "id": "provider_certification",
      "title": "Medical Provider Certification",
      "patientTitle": "What the clinician will decide",
      "order": 80,
      "owner": "clinician",
      "renderOnOfficialForm": true
    },
    {
      "id": "provider_attestation",
      "title": "Provider Attestation",
      "patientTitle": "Clinician signature",
      "order": 90,
      "owner": "clinician",
      "renderOnOfficialForm": true
    }
  ],
  "fields": [
    {
      "id": "applicant.legal_name.first",
      "sectionId": "applicant_information",
      "label": "First name",
      "type": "text",
      "owner": "patient",
      "required": true,
      "allowedSources": [
        "patient_chat",
        "patient_direct_entry",
        "uploaded_document",
        "emr_demographics"
      ],
      "rendering": {
        "mode": "review_packet",
        "implemented": true
      },
      "patientQuestion": "What is your legal first name?",
      "confirmationRequired": true,
      "validation": {
        "minLength": 1,
        "maxLength": 60
      }
    },
    {
      "id": "applicant.legal_name.middle",
      "sectionId": "applicant_information",
      "label": "Middle name",
      "type": "text",
      "owner": "patient",
      "required": false,
      "allowedSources": [
        "patient_chat",
        "patient_direct_entry",
        "uploaded_document",
        "emr_demographics"
      ],
      "rendering": {
        "mode": "review_packet",
        "implemented": true
      },
      "patientQuestion": "What is your middle name? You can skip this if you do not have one.",
      "unknownAllowed": true,
      "confirmationRequired": true,
      "validation": {
        "maxLength": 60
      }
    },
    {
      "id": "applicant.legal_name.last",
      "sectionId": "applicant_information",
      "label": "Last name",
      "type": "text",
      "owner": "patient",
      "required": true,
      "allowedSources": [
        "patient_chat",
        "patient_direct_entry",
        "uploaded_document",
        "emr_demographics"
      ],
      "rendering": {
        "mode": "review_packet",
        "implemented": true
      },
      "patientQuestion": "What is your legal last name?",
      "confirmationRequired": true,
      "validation": {
        "minLength": 1,
        "maxLength": 60
      }
    },
    {
      "id": "applicant.date_of_birth",
      "sectionId": "applicant_information",
      "label": "Date of birth",
      "type": "date",
      "owner": "patient",
      "required": true,
      "allowedSources": [
        "patient_chat",
        "patient_direct_entry",
        "uploaded_document",
        "emr_demographics"
      ],
      "rendering": {
        "mode": "review_packet",
        "implemented": true
      },
      "patientQuestion": "What is your date of birth?",
      "confirmationRequired": true,
      "validation": {
        "dateNotFuture": true
      }
    },
    {
      "id": "applicant.address.residential",
      "sectionId": "applicant_information",
      "label": "Residential address",
      "type": "address",
      "owner": "patient",
      "required": true,
      "allowedSources": [
        "patient_chat",
        "patient_direct_entry",
        "uploaded_document",
        "emr_demographics"
      ],
      "rendering": {
        "mode": "review_packet",
        "implemented": true
      },
      "patientQuestion": "What is your current home address?",
      "confirmationRequired": true
    },
    {
      "id": "applicant.address.mailing_same_as_residential",
      "sectionId": "applicant_information",
      "label": "Mailing address is the same",
      "type": "boolean",
      "owner": "patient",
      "required": true,
      "allowedSources": [
        "patient_chat",
        "patient_direct_entry",
        "uploaded_document"
      ],
      "rendering": {
        "mode": "review_packet",
        "implemented": true
      },
      "patientQuestion": "Is your mailing address the same as your home address?",
      "confirmationRequired": true
    },
    {
      "id": "applicant.address.mailing",
      "sectionId": "applicant_information",
      "label": "Mailing address",
      "type": "address",
      "owner": "patient",
      "required": false,
      "allowedSources": [
        "patient_chat",
        "patient_direct_entry",
        "uploaded_document",
        "emr_demographics"
      ],
      "rendering": {
        "mode": "review_packet",
        "implemented": true
      },
      "patientQuestion": "What mailing address should be used?",
      "confirmationRequired": true
    },
    {
      "id": "applicant.driver_license_or_id",
      "sectionId": "applicant_information",
      "label": "Driver license or identification number",
      "type": "identifier",
      "owner": "patient",
      "required": false,
      "allowedSources": [
        "patient_direct_entry",
        "uploaded_document"
      ],
      "rendering": {
        "mode": "review_packet",
        "implemented": true
      },
      "patientQuestion": "What California driver license or identification card number should appear on the application?",
      "patientHelpText": "Enter this only in the protected field, not in the chat message.",
      "sensitive": true,
      "confirmationRequired": true,
      "validation": {
        "maxLength": 30
      }
    },
    {
      "id": "applicant.phone",
      "sectionId": "applicant_information",
      "label": "Telephone number",
      "type": "phone",
      "owner": "patient",
      "required": true,
      "allowedSources": [
        "patient_chat",
        "patient_direct_entry",
        "uploaded_document",
        "emr_demographics"
      ],
      "rendering": {
        "mode": "review_packet",
        "implemented": true
      },
      "patientQuestion": "What is the best phone number for this application?",
      "confirmationRequired": true
    },
    {
      "id": "applicant.email",
      "sectionId": "applicant_information",
      "label": "Email address",
      "type": "email",
      "owner": "patient",
      "required": false,
      "allowedSources": [
        "patient_chat",
        "patient_direct_entry",
        "uploaded_document",
        "emr_demographics"
      ],
      "rendering": {
        "mode": "review_packet",
        "implemented": true
      },